{
  "id": "CL001",
  "statement": "A missing element is used as a formal device.",
  "type": "INFERENCE",
  "evidence_ids": ["EV001"],
  "supporting_claims": [],
  "opposing_claims": [],
  "scope": "project/harmony-study",
  "epistemic_status": "SUPPORTED",
  "confidence": {
    "source_reliability": 3,
    "directness": 2,
    "corroboration": 3,
    "freshness": 4,
    "scope_fit": 3,
    "conflict_penalty": 0,
    "derived_score": 69
  },
  "valid_from": "2026-08-11",
  "review_after": "2027-02-11"
}
